Date,Issuer,Symbol,Lead/Joint-Lead  Managers,Offer Price,Opening Price,1st Day Close,1st Day % Px Chng,$ Chg Opening,$ Chg Close,Star Ratings,Performed
1/13/2017,Gores Holdings II ,GSHTU,Deutsche Bank Securities,$10.00 ,$10.16 ,$10.25 ,2.50%,$0.16 ,$0.25 ,1,
1/20/2017,FinTech Acquisition Corp. II,FNTEU,Cantor Fitzgerald & Co.,$10.00 ,$10.10 ,$10.05 ,0.50%,$0.10 ,$0.05 ,1,
1/20/2017,Keane Group ,FRAC,Citigroup/ Morgan Stanley/ BofA Merrill Lynch/ J.P. Morgan,$19.00 ,$22.18 ,$21.65 ,13.95%,$3.18 ,$2.65 ,3,
1/26/2017,AnaptysBio ,ANAB,Credit Suisse/ Stifel,$15.00 ,$16.00 ,$17.00 ,13.33%,$1.00 ,$2.00 ,2,
1/26/2017,ObsEva SA  ,OBSV,Credit Suisse/ Jefferies/ Leerink Partners,$15.00 ,$13.29 ,$11.65 ,-22.33%,($1.71),($3.35),2,Missed
1/27/2017,Jagged Peak Energy ,JAG,Citigroup/ Credit Suisse/ J.P. Morgan,$15.00 ,$14.18 ,$14.33 ,-4.47%,($0.82),($0.67),1,
1/27/2017,JELD-WEN Holding ,JELD,Barclays/ Citigroup/ Credit Suisse/ J.P. Morgan,$23.00 ,$25.32 ,$26.12 ,13.57%,$2.32 ,$3.12 ,3,
1/27/2017,Jounce Therapeutics ,JNCE,J.P. Morgan/ Cowen and Company,$16.00 ,$18.00 ,$17.25 ,7.81%,$2.00 ,$1.25 ,2,
1/27/2017,REV Group ,REVG,Goldman Sachs/ Morgan Stanley/ Baird,$22.00 ,$25.75 ,$25.00 ,13.64%,$3.75 ,$3.00 ,2,
2/1/2017,Invitation Homes ,INVH,Deutsche Bank Securities/ J.P. Morgan/ BofA Merrill Lynch/ Goldman Sachs/ Wells Fargo Securities/ Credit Suisse/ Morgan Stanley/ RBC Capital Market,$20.00 ,$20.15 ,$20.00 ,0.00%,$0.15 ,$0.00 ,2,Missed
2/1/2017,Laureate Education ,LAUR,Credit Suisse/ Morgan Stanley/ Barclays/ Macquarie Capital/ J.P. Morgan/ BMO Capital Markets/ Citigroup/ KKR/ Goldman Sachs,$14.00 ,$12.50 ,$13.25 ,-5.36%,($1.50),($0.75),1,
2/3/2017,"Kimbell Royalty Partners, LP ",KRP,Raymond James/ RBC Capital Markets/ Stifel,$18.00 ,$18.11 ,$20.64 ,14.67%,$0.11 ,$2.64 ,1,
2/3/2017,Ramaco Resources ,METC,Credit Suisse/ Jefferies/ BMO Capital Markets,$13.50 ,$14.55 ,$13.55 ,0.37%,$1.05 ,$0.05 ,2,
2/10/2017,Clipper Realty ,CLPR,FBR/ Raymond James,$13.50 ,$15.00 ,$13.50 ,0.00%,$1.50 ,$0.00 ,1,
2/10/2017,Foundation Building Materials ,FBM,Deutsche Bank Securities/ Barclays/ RBC Capital Markets/ Citigroup/ Baird,$14.00 ,$15.80 ,$15.50 ,10.71%,$1.80 ,$1.50 ,1,
2/10/2017,Sachem Capital ,SACH,Joseph Gunnar,$5.00 ,$4.90 ,$5.04 ,0.80%,($0.10),$0.04 ,1,
3/1/2017,Hamilton Lane ,HLNE,J.P. Morgan/ Morgan Stanle,$16.00 ,$17.85 ,$18.02 ,12.63%,$1.85 ,$2.02 ,2,
3/2/2017,Snap ,SNAP,Morgan Stanley/ Goldma Sachs/ J. P. Morgan/ Deutsche Bank Securities,$17.00 ,$23.71 ,$24.48 ,44.00%,$6.71 ,$7.48 ,3,
3/8/2017,J.JILL ,JILL,BofA Merrill Lynch/Morgan Stanley/ Jefferies,$13.00 ,$12.85 ,$12.65 ,-2.69%,($0.15),($0.35),1,
3/8/2017,BeyondSpring ,BYSI,Rodman & Renshaw (a Unit of H.C. Wainwright & Co.),$20.00 ,$20.00 ,$16.80 ,-16.00%,$0.00 ,($3.20),N/C,No Call
3/10/2017,Presidio ,PSDO,J.P. Morgan/ Citigroup,$14.00 ,$13.50 ,$14.25 ,1.79%,($0.50),$0.25 ,2,Missed
3/10/2017,Matlin & Partners Acquisition ,MPACU,Cantor Fitzgerald & Co.,$10.00 ,$10.00 ,$10.01 ,0.10%,$0.00 ,$0.01 ,1,
3/15/2017,Ardagh Group S.A.  ,ARD,"Citigroup/ Deutsche Bank Securities/ Goldman, Sachs/ Barclays/ Credit Suisse/ J.P. Morgan",$19.00 ,$21.96 ,$22.91 ,20.58%,$2.96 ,$3.91 ,1,Missed
3/16/2017,Canada Goose Holdings ,GOOS,"CIBC Capital Markets/ Credit Suisse/ Goldman, Sachs/ RBC Capital Markets",$12.78 ,$18.00 ,$16.08 ,25.82%,$5.22 ,$3.30 ,3,
3/17/2017,MuleSoft ,MULE,"Goldman, Sachs/ J.P. Morgan/ BoA Merrill Lynch",$17.00 ,$24.25 ,$24.75 ,45.59%,$7.25 ,$7.75 ,3,
3/17/2017,ProPetro Holding ,PUMP,Goldman Sachs/ Barclays/ Credit Suisse/ J.P. Morgan,$14.00 ,$15.00 ,$14.50 ,3.57%,$1.00 ,$0.50 ,1,
3/24/2017,Alteryx ,AYX,"Goldman, Sachs/ J.P. Morgan",$14.00 ,$17.25 ,$15.50 ,10.71%,$3.25 ,$1.50 ,3,
3/24/2017,Silver Run Acquisition Corp II ,SRUNU,Citigroup/ Credit Suisse/ Deutsche Bank Securities,$10.00 ,$10.21 ,$10.36 ,3.60%,$0.21 ,$0.36 ,1,
3/30/2017,Kayne Anderson Acquisition ,KAACU,Citigroup/ Deutsche Bank Securities/ Credit Suisse,$10.00 ,$10.09 ,$10.00 ,0.00%,$0.09 ,$0.00 ,1,
4/5/2017,Hess Midstream Partners LP,MESM,"Goldman, Sachs/ Morgan Stanley",$23.00 ,$25.50 ,$25.60 ,11.30%,$2.50 ,$2.60 ,2,
4/6/2017,Schneider National ,SNDR,Morgan Stanley/ UBS Investment Bank/ BofA Merrill Lynch,$19.00 ,$19.50 ,$19.00 ,0.00%,$0.50 ,$0.00 ,2,
4/6/2017,Elevate Credit ,ELVT,UBS Securities/ Jefferies/ Stifel/ William Blair & Company,$6.50 ,$7.00 ,$7.76 ,19.38%,$0.50 ,$1.26 ,1,
4/7/2017,Forum Merger,FMCIU,EarlyBirdCapital,$10.00 ,$10.00 ,$10.00 ,0.00%,$0.00 ,$0.00 ,1,
4/7/2017,Okta,OKTA,"Goldman, Sachs/ J.P. Morgan Securities/ Allen & Company",$17.00 ,$17.00 ,$23.56 ,38.59%,$0.00 ,$6.56 ,3,
4/11/2017,Azul S.A. ,AZUL,Citigroup/ Itaú BBA/ Deutsche Bank Securities,$20.06 ,$21.80 ,$21.50 ,7.18%,$1.74 ,$1.44 ,2,
4/11/2017,Vantage Energy Acquisition ,VEACU,"Citigroup/ Credit Suisse/ Goldman, Sachs",$10.00 ,$10.10 ,$10.00 ,0.00%,$0.10 ,$0.00 ,1,
4/12/2017,Netshoes (Cayman) Ltd. ,NETS,"Goldman, Sachs/ J.P. Morgan/ Bradesco BBI/ Allen & Company/ Jefferies",$18.00 ,$16.32 ,$16.10 ,-10.56%,($1.68),($1.90),2,Missed
4/13/2017,Cadence Bancorporation ,CADE,"Goldman, Sachs/ J.P. MorganSandle/ O’Neill + Partners/ Keefe, Bruyette & Woods (A Stifel Company)",$20.00 ,$22.08 ,$21.55 ,7.75%,$2.08 ,$1.55 ,2,
4/13/2017,Tocagen ,TOCA,Leerink Partners/ Evercore ISI/ Stifel,$10.00 ,$10.27 ,$12.45 ,24.50%,$0.27 ,$2.45 ,2,
4/13/2017,Warrior Met Coal ,HCC,Credit Suisse/ Citigroup/ Morgan Stanley/ BMO Capital Markets/ RBC Capital Markets,$19.00 ,$17.50 ,$18.00 ,-5.26%,($1.50),($1.00),2,Missed
4/13/2017,Yext,YEXT,Morgan Stanley/ J.P. Morgan/ RBC Capital Markets,$11.00 ,$14.03 ,$13.41 ,21.91%,$3.03 ,$2.41 ,3,
4/21/2017,Select Energy Services ,WTTR,Credit Suisse/ FBR/ Wells Fargo Securities/ BofA Merrill Lynch/ Citigroup/ J.P. Morgan,$14.00 ,$14.90 ,$14.02 ,0.14%,$0.90 ,$0.02 ,1,
4/27/2017,Floor & Decor Holdings ,FND,BofA Merrill Lynch/ Barclays/ Credit Suisse / UBS Investment Bank,$21.00 ,$30.25 ,$32.05 ,52.62%,$9.25 ,$11.05 ,3,
4/28/2017,Carvana ,CVNA,Wells Fargo Securities/ BofA Merrill Lynch/ Citigroup/ Deutsche Bank Securities,$15.00 ,$13.71 ,$11.10 ,-26.00%,($1.29),($3.90),3,Missed
4/28/2017,China Rapid Finance Limited ,XRF,Morgan Stanley/ Credit Suisse/ Jefferies,$6.00 ,$6.67 ,$6.67 ,11.17%,$0.67 ,$0.67 ,1,
4/28/2017,Cloudera ,CLDR,Morgan Stanley/ J.P. Morga/ Allen & Company,$15.00 ,$17.87 ,$18.10 ,20.67%,$2.87 ,$3.10 ,3,
4/28/2017,Emerald Expositions Events ,EEX,"BofA Merrill Lynch/ Barclays/ Goldman, Sachs",$17.00 ,$18.73 ,$19.50 ,14.71%,$1.73 ,$2.50 ,1,Missed
4/28/2017,NCS Multistage Holdings ,NCSM,Credit Suisse/ Citigroup/ Wells Fargo Securities,$17.00 ,$20.00 ,$19.50 ,14.71%,$3.00 ,$2.50 ,1,Missed
4/28/2017,Zymeworks ,ZYME,Citigroup/ Barclays/ Wells Fargo Securities/ Canaccord Genuity,$13.00 ,$13.50 ,$13.00 ,0.00%,$0.50 ,$0.00 ,3,Missed
5/4/2017,Antero Resources Midstream Management ,AMGP,Morgan Stanley/ Barclays/ J.P. Morgan,$23.50 ,$22.19 ,$22.00 ,-6.38%,($1.31),($1.50),2,
5/4/2017,Biohaven Pharmaceutical Holding ,BHVN,Morgan Stanley/ Piper Jaffray/ Barclays Capital,$17.00 ,$20.24 ,$17.50 ,2.94%,$3.24 ,$0.50 ,2,
5/4/2017,UroGen Pharma Ltd. ,URGN,Jefferies/ Cowen and Company,$13.00 ,$13.28 ,$13.98 ,7.54%,$0.28 ,$0.98 ,2,
5/5/2017,KKR Real Estate Finance Trust ,KREF,Wells Fargo Securities/ Morgan Stanley/ KKR,$20.50 ,$21.01 ,$22.13 ,7.95%,$0.51 ,$1.63 ,1,Missed
5/5/2017,Ovid Therapeut ,OVID,Citigroup/ Cowen and Company,$15.00 ,$14.00 ,$12.25 ,-18.33%,($1.00),($2.75),1,
5/5/2017,TPG Pace Energy Holdings ,TPGEU,"Deutsche Bank Securities/ Goldman, Sachs",$10.00 ,$10.10 ,$10.14 ,1.40%,$0.10 ,$0.14 ,1,
5/9/2017,ENDRA Life Sciences ,NDRAU,Dougherty & Company/Dawson James Securities,$5.00 ,$5.45 ,$5.20 ,4.00%,$0.45 ,$0.20 ,1,
5/9/2017,Guaranty Bancshares ,GNTY,Sandler O’Neill + Partners/ Stephens,$27.00 ,$30.00 ,$30.10 ,11.48%,$3.00 ,$3.10 ,2,
5/10/2017,Five Point Holdings ,FPH,Citigroup/ J.P. Morgan,$14.00 ,$15.25 ,$15.04 ,7.43%,$1.25 ,$1.04 ,1,
5/12/2017,A.S.V. ,ASV,Roth Capital Partners,$7.00 ,$7.45 ,$7.85 ,12.14%,$0.45 ,$0.85 ,1,
5/12/2017,Gardner Denver Holdings ,GDI,"Goldman, Sachs/ Citigroup/ UBS Investment Bank/ KKR/ Simmons & Company International (Energy Specialists of Piper Jaffray)/ Deutsche Bank Securities/ Baird/ Credit Suisse/ Morgan Stanley",$20.00 ,$21.20 ,$21.10 ,5.50%,$1.20 ,$1.10 ,1,
5/12/2017,Modern Media Acquisition ,MMDMU,Macquarie Capital,$10.00 ,$10.09 ,$10.11 ,1.10%,$0.09 ,$0.11 ,1,
5/12/2017,National Energy Services Reunited ,NESRU,Maxim Group/ National Bank of Canada Financial,$10.00 ,$10.00 ,$9.99 ,-0.10%,$0.00 ,($0.01),1,
5/12/2017,Solaris Oilfield Infrastructure ,SOI,"Credit Suisse/ Goldman, Sachs",$12.00 ,$12.23 ,$11.55 ,-3.75%,$0.23 ,($0.45),1,
5/12/2017,Veritone ,VERI,Wunderlich/ Craig-Hallum Capital Group,$15.00 ,$15.64 ,$13.07 ,-12.87%,$0.64 ,($1.93),2,
5/17/2017,G1 Therapeutics ,GTHX,J.P. Morgan/ Cowen and Company,$15.00 ,$15.00 ,$15.00 ,0.00%,$0.00 ,$0.00 ,1,
5/18/2017,Bright Scholar Education Holdings ,BEDU,Morgan Stanley/ Deutsche Bank Securities,$10.50 ,$11.05 ,$13.40 ,27.62%,$0.55 ,$2.90 ,1,
5/24/2017,SMART Global Holdings ,SGH,Barclays/ Deutsche Bank Securities/ Jefferies/ Stifel,$11.00 ,$12.00 ,$13.45 ,22.27%,$1.00 ,$2.45 ,1,
5/25/2017,Appian ,APPN,"Morgan Stanley/ Goldman, Sachs/ Barclays",$12.00 ,$15.00 ,$15.01 ,25.08%,$3.00 ,$3.01 ,2,
5/25/2017,WideOpenWest ,WOW,UBS Investment Bank/ Credit Suisse/ RBC Capital Markets/ SunTrust Robinson Humphrey/ Evercore ISI/ Macquarie Capital,$17.00 ,$16.15 ,$16.50 ,-2.94%,($0.85),($0.50),1,
6/2/2017,KBL Merger Corp. IV  ,KBLMU,Ladenburg Thalmann,$10.00 ,$10.00 ,$10.00 ,0.00%,$0.00 ,$0.00 ,1,
6/7/2017,ShotSpotter,SSTI,Roth Capital Partners/ Northland Capital Markets,$11.00 ,$12.20 ,$14.38 ,30.73%,$1.20 ,$3.38 ,1,
6/9/2017,Plymouth Industrial  REIT ,PLYM,D.A. Davidson/ BB&T Capital Markets/ Oppenheimer,$19.00 ,$18.31 ,$18.39 ,-3.21%,($0.69),($0.61),1,
6/14/2017,Athenex ,ATNX,Credit Suisse/ Deutsche Bank Securities/ J.P. Morgan,$11.00 ,$12.00 ,$12.56 ,14.18%,$1.00 ,$1.56 ,2,Missed
6/14/2017,TCG BDC ,CGBD,"BofA Merrill Lynch/ Morgan Stanley/ J.P. Morgan/ Citigroup/ Keefe, Bruyette & Woods (A Stifel Company)/ Wells Fargo Securities",$18.50 ,$17.80 ,$18.11 ,-2.11%,($0.70),($0.39),1,
6/20/2017,Bison Capital Acquisition ,BCACU,EarlyBirdCapital,$10.00 ,$10.10 ,$10.70 ,7.00%,$0.10 ,$0.70 ,1,
6/20/2017,Constellation Alpha Capital,CNACU,Cowen,$10.00 ,$10.00 ,$10.01 ,0.10%,$0.00 ,$0.01 ,1,
6/22/2017,Altice USA ,ATUS,"J.P. Morgan/ Morgan Stanley/ Citigroup/ Goldman, Sachs/ BofA Merrill Lynch/ Barclays/ BNP PARIBAS/ Deutsche Bank Securities/ RBC Capital Markets",$30.00 ,$31.60 ,$32.71 ,9.03%,$1.60 ,$2.71 ,2,
6/22/2017,"Safety, Income and Growth ",SAFE,BofA Merrill Lync/ J.P. Morgan/ Barclays/ Citigroup/ Raymond James,$20.00 ,$19.00 ,$19.00 ,-5.00%,($1.00),($1.00),1,
6/22/2017,SG Blocks ,SBGX,Joseph Gunnar,$5.00 ,$4.75 ,$4.92 ,-1.60%,($0.25),($0.08),1,
6/23/2017,Granite Point Mortgage Trust ,GPMT,J.P. Morgan/ Morgan Stanley/ Citigroup,$19.50 ,$18.25 ,$19.00 ,-2.56%,($1.25),($0.50),1,
6/23/2017,Hennessy Capital Acquisition Corp. III ,HCAC.U,Credit Suisse/ Stifel,$10.00 ,$10.04 ,$10.05 ,0.50%,$0.04 ,$0.05 ,1,
6/26/2017,Avenue Therapeutics ,ATXI,Oppenheimer,$6.00 ,$7.60 ,$8.25 ,37.50%,$1.60 ,$2.25 ,1,Missed
6/26/2017,Esquire Financial Holdings ,ESQ,Sandler O’Neill & Partners,$14.00 ,$15.90 ,$15.25 ,8.93%,$1.90 ,$1.25 ,2,
6/27/2017,Mersana Therapeutics ,MRSN,J.P. Morgan/ Cowen/ Leerink Partners,$15.00 ,$14.25 ,$14.00 ,-6.67%,($0.75),($1.00),3,Missed
6/27/2017,TPG Pace Holdings ,TPGH.U,Deutsche Bank Securities/ Goldman Sachs,$10.00 ,$10.20 ,$10.25 ,2.50%,$0.20 ,$0.25 ,1,
6/29/2017,Aileron Therapeutics ,ALRN,BofA Merrill Lynch/ Jefferies,$15.00 ,$13.75 ,$10.80 ,-28.00%,($1.25),($4.20),2,Missed
6/29/2017,Blue Apron Holdings ,APRN,Goldman Sachs/ Morgan Stanley/ Citigroup/ Barclays,$10.00 ,$10.00 ,$10.00 ,0.00%,$0.00 ,$0.00 ,1,
6/29/2017,Dova Pharmaceuticals ,DOVA,J.P. Morgan/ Jefferies/ Leerink Partners,$17.00 ,$19.25 ,$19.81 ,16.53%,$2.25 ,$2.81 ,2,
6/30/2017,Byline Bancorp ,BY,"BofA Merrill Lynch/ Keefe, Bruyette & Woods (A Stifel Company)",$19.00 ,$20.35 ,$20.05 ,5.53%,$1.35 ,$1.05 ,2,
6/30/2017,Tintri ,TNTR,Morgan Stanley/ BofAMerrill Lynch/ Pacific Crest Securities (a division of KeyBanc Capital Markets),$7.00 ,$7.12 ,$7.27 ,3.86%,$0.12 ,$0.27 ,1,
7/12/2017,Co-Diagnostics ,CODX,WallachBeth Capital/ Network 1 Securities,$6.00 ,$6.00 ,$5.81 ,-3.17%,$0.00 ,($0.19),1,
7/14/2017,Akcea Therapeutics ,AKCA,Cowen and Company/ Stifel/ Wells Fargo Securities,$8.00 ,$8.13 ,$9.48 ,18.50%,$0.13 ,$1.48 ,1,
7/19/2017,Federal Street Acquisition ,FSACU,Citigroup/ BofA Merrill Lynch,$10.00 ,$10.06 ,$10.10 ,1.00%,$0.06 ,$0.10 ,1,
7/20/2017,Calyxt ,CLXT,Citigroup/ Credit Suisse/ Jefferies,$8.00 ,$9.50 ,$11.25 ,40.63%,$1.50 ,$3.25 ,1,
7/20/2017,Kala Pharmaceuticals ,KALA,J.P. Morgan/ BofA Merrill Lynch ,$15.00 ,$16.70 ,$18.62 ,24.13%,$1.70 ,$3.62 ,2,
7/20/2017,TPG RE Finance Trust ,TRTX,"BofA Merrill Lynch/ Citigroup/ Goldman, Sachs/ Wells Fargo Securities/ Deutsche Bank Securities/ Morgan Stanley/ Barclays",$20.00 ,$19.58 ,$19.58 ,-2.10%,($0.42),($0.42),1,
7/21/2017,PetIQ ,PETQ,Jefferies/ William Blair,$16.00 ,$21.00 ,$23.25 ,45.31%,$5.00 ,$7.25 ,1,Missed
7/26/2017,RBB Bancorp ,RBB,"Sandler O’Neill/ Keefe, Bruyette & Woods (A Stifel Company)/ Stephens",$23.00 ,$23.32 ,$23.35 ,1.52%,$0.32 ,$0.35 ,2,
7/27/2017,Industrea Acquisition ,INDUU,FBR/ B. Riley & Co.,$10.00 ,$10.02 ,$10.02 ,0.20%,$0.02 ,$0.02 ,1,
7/27/2017,Pensare Acquisition ,WRLSU,EarlyBirdCapital,$10.00 ,$10.05 ,$10.04 ,0.40%,$0.05 ,$0.04 ,1,
7/27/2017,Sienna Biopharmaceuticals (SNNA),SNNA,J.P. Morgan/ Cowen/ BMO Capital Markets,$15.00 ,$19.05 ,$19.25 ,28.33%,$4.05 ,$4.25 ,2,
7/28/2017,Newater Technology ,NEWA,ViewTrade Securities,$5.00 ,$7.32 ,$8.93 ,78.60%,$2.32 ,$3.93 ,N/C,No Call
7/28/2017,Redfin ,RDFN,Goldman Sachs/ Allen & Company/ BofA Merrill Lynch/ RBC Capital Markets,$15.00 ,$19.56 ,$21.70 ,44.67%,$4.56 ,$6.70 ,3,
8/2/2017,Clementia Pharmaceuticals ,CMTA,Morgan Stanley/ Leerink Partners,$15.00 ,$18.25 ,$16.35 ,9.00%,$3.25 ,$1.35 ,3,
8/3/2017,Venator Materials PLC ,VNTR,Citigroup/ Goldman Sachs/ BofA Merrill Lynch/ J.P. Morgan ,$20.00 ,$20.89 ,$20.65 ,3.25%,$0.89 ,$0.65 ,1,
8/9/2017,I-AM Capital Acquisition ,IAMXU,Maxim Group LLC,$10.00 ,$10.05 ,$10.05 ,0.50%,$0.05 ,$0.05 ,1,
8/11/2017,Ranger Energy Services ,RNGR,Credit Suisse/ Simmons & Company International (Energy Specialists of Piper Jaffray)/ Wells Fargo Securities,$14.50 ,$14.00 ,$14.22 ,-1.93%,($0.50),($0.28),2,Missed
8/11/2017,YogaWorks ,YOGA,Cowen/ Stephens/ Guggenheim Securities,$5.50 ,$5.50 ,$4.85 ,-11.82%,$0.00 ,($0.65),2,Missed
8/16/2017,Capitol Investment Corp. IV ,CIC.U,Citigroup/ Deutsche Bank Securities/ J.P. Morgan,$10.00 ,$10.10 ,$10.02 ,0.20%,$0.10 ,$0.02 ,1,
8/17/2017,Atlantic Acquisition,ATACU,EarlyBirdCapital/ I-Bankers,$10.00 ,$10.05 ,$10.06 ,0.60%,$0.05 ,$0.06 ,1,
9/14/2017,Social Capital Hedosophia Holdings ,IPOA.U,Credit Suisse,$10.00 ,$10.20 ,$10.31 ,3.10%,$0.20 ,$0.31 ,1,
9/14/2017,Tremont Mortgage Trust (TRMT),TRMT,UBS Investment Bank/ Citigroup/ RBC Capital Markets,$20.00 ,$17.75 ,$17.29 ,-13.55%,($2.25),($2.71),1,
9/15/2017,Draper Oakwood Technology Acquisition ,DOTAU,EarlyBirdCapital,$10.00 ,$10.07 ,$10.16 ,1.60%,$0.07 ,$0.16 ,1,
9/20/2017,BEST Inc. ,BSTI,Citigroup/ Credit Suisse/ Goldman Sachs/ J.P. Morgan/ Deutsche Bank,$10.00 ,$11.48 ,$10.52 ,5.20%,$1.48 ,$0.52 ,1,
9/20/2017,Celcuity ,CELC,Craig-Hallum Capital Group,$9.50 ,$12.35 ,$14.29 ,50.42%,$2.85 ,$4.79 ,1,Missed
9/20/2017,Despegar.com ,DESP,Morgan Stanley/ Citigroup,$26.00 ,$29.00 ,$31.78 ,22.23%,$3.00 ,$5.78 ,2,
9/20/2017,Krystal Biotech ,KRYS,Ladenburg Thalmann,$10.00 ,$10.50 ,$10.64 ,6.40%,$0.50 ,$0.64 ,1,
9/20/2017,Zai Lab,ZLAB,J.P. Morgan/ Citigroup/ Leerink Partners,$18.00 ,$24.00 ,$27.93 ,55.17%,$6.00 ,$9.93 ,2,
9/21/2017,Oasis Midstream Partners LP ,OMP,Morgan Stanley/ Citigroup/ Wells Fargo Securities,$17.00 ,$16.75 ,$16.75 ,-1.47%,($0.25),($0.25),1,
9/21/2017,TDH Holdings ,PETZ,ViewTrade Securities,$4.25 ,$6.75 ,$6.41 ,50.82%,$2.50 ,$2.16 ,N/C,No Call
9/22/2017,Secoo Holding Limited ,SECO,Jefferies,$13.00 ,$12.10 ,$10.00 ,-23.08%,($0.90),($3.00),1,
9/27/2017,RYB Education ,RYB,Credit Suisse/ Morgan Stanley,$18.50 ,$24.12 ,$25.90 ,40.00%,$5.62 ,$7.40 ,2,
2/28/2017,Deciphera Pharmaceuticals ,DCPH,J.P. Morgan/ Piper Jaffray,$17.00 ,$20.05 ,$17.65 ,3.82%,$3.05 ,$0.65 ,2,
9/28/2017,Nightstar Therapeutics ,NITE,Jefferies/ Leerink Partners/ BMO Capital Markets,$14.00 ,$17.25 ,$24.00 ,71.43%,$3.25 ,$10.00 ,1,
9/28/2017,NuCana plc ,NCNA,Citigroup/ Jefferies/ Cowen,$15.00 ,$15.50 ,$16.15 ,7.67%,$0.50 ,$1.15 ,1,
9/28/2017,Roku ,ROKU,Morgan Stanley/ Citigroup,$14.00 ,$15.78 ,$23.50 ,67.86%,$1.78 ,$9.50 ,2,
9/29/2017,PQ Group ,PGQ,Morgan Stanley/ Goldman Sachs/ Citigroup/ Credit Suisse,$17.50 ,$17.00 ,$17.25 ,-1.43%,($0.50),($0.25),1,
10/5/2017,Black Ridge Acquisition ,BRACU,EarlyBirdCapital,$10.00 ,$10.09 ,$10.15 ,1.50%,$0.09 ,$0.15 ,1,
10/5/2017,Rhythm Pharmaceuticals ,RYTH,Morgan Stanley/ BofA Merrill Lynch/ Cowen,$17.00 ,$23.21 ,$30.00 ,76.47%,$6.21 ,$13.00 ,3,
10/6/2017,Switch ,SWCH,Goldman Sachs/ J.P. Morgan/ BMO Capital Markets/ Wells Fargo Securities,$17.00 ,$21.70 ,$20.84 ,22.59%,$4.70 ,$3.84 ,3,
10/12/2017,CarGurus ,CARG,Goldman Sachs/ Allen & Company/ RBC Capital Markets,$16.00 ,$29.00 ,$27.58 ,72.38%,$13.00 ,$11.58 ,3,
10/12/2017,OrthoPediatrics  ,KIDS,Piper Jaffray/ Stifel,$13.00 ,$18.00 ,$19.72 ,51.69%,$5.00 ,$6.72 ,2,
10/12/2017,Restoration Robotics ,HAIR,National Securities Corporation,$7.00 ,$8.85 ,$9.92 ,41.71%,$1.85 ,$2.92 ,1,Missed
10/13/2017,OptiNose,OPTN,Jefferies/ Piper Jaffray/ BMO Capital Markets/ RBC Capital Markets,$16.00 ,$20.00 ,$19.00 ,18.75%,$4.00 ,$3.00 ,2,
10/18/2017,Qudian ,QD,Morgan Stanley/ Credit Suisse/ Citigroup/CICc/ UBS Securities,$24.00 ,$34.50 ,$29.18 ,21.58%,$10.50 ,$5.18 ,3,
10/19/2017,MongoDB ,MDB,Morgan Stanley/ Goldman Sachs/ Barclays/ Allen & Company,$24.00 ,$33.00 ,$32.07 ,33.63%,$9.00 ,$8.07 ,3,
10/19/2017,Mosaic Acquisition ,MOSC.U,Deutsche Bank Securities/ RBC Capital Markets/ J.P. Morgan,$10.00 ,$10.20 ,$10.15 ,1.50%,$0.20 ,$0.15 ,1,
10/20/2017,Sea Limited ,SE,Goldman Sachs (Asia)/ Morgan Stanley/ Credit Suisse,$15.00 ,$16.25 ,$16.26 ,8.40%,$1.25 ,$1.26 ,3,
10/20/2017,RISE Education Cayman ,REDU,Morgan Stanley/ Credit Suisse,$14.50 ,$16.00 ,$16.61 ,14.55%,$1.50 ,$2.11 ,3,
10/25/2017,Haymaker Acquisition ,HYACU,Cantor Fitzgerald,$10.00 ,$10.07 ,$10.01 ,0.10%,$0.07 ,$0.01 ,1,
10/26/2017,BP Midstream Partners LP ,BPMP,Citigroup/ Goldman Sachs/ Morgan Stanley/ Barclays/ Credit Suisse/ J.P. Morgan/ UBS Investment Bank,$18.00 ,$16.85 ,$17.25 ,-4.17%,($1.15),($0.75),1,
10/26/2017,CM Seven Star Acquisition ,CMSSU,EarlyBirdCapital,$10.00 ,$10.01 ,$10.01 ,0.10%,$0.01 ,$0.01 ,1,
10/26/2017,National Vision Holdings ,EYE,BofA Merrill Lynch/ Goldman Sachs/ Citigroup/ KKR/ Morgan Stanley/ Jefferies/ UBS Investment Bank/ Wells Fargo Securities,$22.00 ,$28.75 ,$27.83 ,26.50%,$6.75 ,$5.83 ,3,
10/27/2017,Merchants Bancorp ,MBIN,Sandler O'Neill + Partners/ Stephens/ Raymond James,$16.00 ,$17.00 ,$16.80 ,5.00%,$1.00 ,$0.80 ,2,
10/27/2017,Nexa Resources S.A. ,NEXA,J.P. Morgan/ BMO Capital Markets/ Morgan Stanley/ Credit Suisse,$16.00 ,$16.50 ,$17.40 ,8.75%,$0.50 ,$1.40 ,1,
10/27/2017,ForeScout Technologies ,FSCT,Morgan Stanley/ J.P. Morgan/ Citigroup,$22.00 ,$26.25 ,$25.50 ,15.91%,$4.25 ,$3.50 ,3,
11/1/2017,Altair Engineering ,ALTR,J.P. Morgan/ RBC Capital Markets/ Deutsche Bank Securities,$13.00 ,$17.00 ,$18.31 ,40.85%,$4.00 ,$5.31 ,3,
11/1/2017,Loma Negra ,LOMA,BofA Merrill Lynch/ Bradesco BBI/ Citigroup/ HSBC/ Itaú BBA/ Morgan Stanley,$19.00 ,$21.65 ,$21.35 ,12.37%,$2.65 ,$2.35 ,2,
11/2/2017,Allena Pharmaceuticals ,ALNA,Credit Suisse/ Jefferies/ Cowen,$14.00 ,$12.00 ,$9.98 ,-28.71%,($2.00),($4.02),1,
11/2/2017,Evoqua Water Technologies ,AQUA,Credit Suisse/ J.P. Morgan/ RBC Capital Markets,$18.00 ,$19.10 ,$20.88 ,16.00%,$1.10 ,$2.88 ,2,
11/2/2017,Funko ,FNKO,Goldman Sachs/ J.P. Morgan/ BofA Merrill Lynch,$12.00 ,$8.00 ,$7.07 ,-41.08%,($4.00),($4.93),2,Missed
11/2/2017,Spero Therapeutics ,SPRO,BofA Merrill Lynch/ Cowen/ Stifel,$14.00 ,$13.25 ,$11.50 ,-17.86%,($0.75),($2.50),2,Missed
11/3/2017,ACM Research ,ACMR,Roth Capital Partners,$5.60 ,$8.17 ,$6.05 ,8.04%,$2.57 ,$0.45 ,1,
11/3/2017,Aquantia ,AQ,Morgan Stanley/ Barclays/ Deutsche Bank Securities,$9.00 ,$9.31 ,$9.51 ,5.67%,$0.31 ,$0.51 ,1,
11/3/2017,Sentinel Energy Services ,STNLU,Citigroup/ Goldman Sachs/ Credit Suisse,$10.00 ,$10.14 ,$10.05 ,0.50%,$0.14 ,$0.05 ,1,
11/8/2017,CBTX ,CBTX,"Stephens/Keefe, Bruyette",$26.00 ,$28.00 ,$28.71 ,10.42%,$2.00 ,$2.71 ,2,
11/8/2017,Fireman B.V. ,IFRX,J.P. Morgan/ Leerink Partners/ BMO Capital Markets,$15.00 ,$15.19 ,$14.99 ,-0.07%,$0.19 ,($0.01),1,
11/8/2017,Four Seasons Education ,FEDU,Morgan Stanley/ Citigroup/ China Renaissance,$10.00 ,$10.20 ,$9.50 ,-5.00%,$0.20 ,($0.50),1,
11/8/2017,Metropolitan Bank Holding ,MCB,"J.P Morgan/ Keefe, Bruyette & Woods (A Stifel Company)",$35.00 ,$38.44 ,$37.21 ,6.31%,$3.44 ,$2.21 ,2,
11/9/2017,Apellis Pharmaceuticals ,APLS,Citigroup/ J.P. Morgan/ Evercore ISI,$14.00 ,$14.50 ,$14.03 ,0.21%,$0.50 ,$0.03 ,1,
11/9/2017,Sogou ,SOGO,J.P. Morgan/ Credit Suisse/ Goldman Sachs/ CICC,$13.00 ,$13.00 ,$13.50 ,3.85%,$0.00 ,$0.50 ,3,Missed
11/10/2017,Bandwidth ,BAND,Morgan Stanley/ KeyBanc Capital Markets/ Baird,$20.00 ,$21.06 ,$21.19 ,5.95%,$1.06 ,$1.19 ,2,
11/10/2017,PPDAI Group ,PPDF,Credit Suisse/ Citigroup,$13.00 ,$13.30 ,$13.08 ,0.62%,$0.30 ,$0.08 ,1,
11/15/2017,SendGrid ,SEND,Morgan Stanley/ J.P. Morgan,$16.00 ,$18.55 ,$18.00 ,12.50%,$2.55 ,$2.00 ,3,
11/16/2017,Arsanis ,ASNS,Citigroup/ Cowen/ Piper Jaffray,$10.00 ,$13.00 ,$14.03 ,40.30%,$3.00 ,$4.03 ,1,
11/16/2017,Jianpu Technology ,JT,Goldman Sachs (Asia)/ Morgan Stanley/ J.P. Morgan,$8.00 ,$8.25 ,$8.40 ,5.00%,$0.25 ,$0.40 ,1,
11/17/2017,Bluegreen Vacations ,BXG,Stifel/ Credit Suisse,$14.00 ,$12.55 ,$13.00 ,-7.14%,($1.45),($1.00),1,
11/17/2017,Legacy Acquisition ,LGCU,Wells Fargo Securities/ Cantor Fitzgerald/ Stifel,$10.00 ,$10.00 ,$10.00 ,0.00%,$0.00 ,$0.00 ,1,
11/17/2017,SailPoint Technologies Holdings ,SAIL,Morgan Stanley/ Citigroup/ Jefferies/ RBC Capital Markets,$12.00 ,$14.90 ,$13.00 ,8.33%,$2.90 ,$1.00 ,3,
11/17/2017,scPharmaceuticals ,SCPH,Jefferies/ Leerink Partners/ BMO Capital Markets,$14.00 ,$14.25 ,$14.10 ,0.71%,$0.25 ,$0.10 ,1,
11/17/2017,Stitch Fix ,SFIX,Goldman Sachs/ J.P. Morgan Securities,$15.00 ,$16.90 ,$15.15 ,1.00%,$1.90 ,$0.15 ,1,
11/17/2017,Sterling Bancorp ,SBT,Sandler O'Neill & Partners,$12.00 ,$12.35 ,$12.16 ,1.33%,$0.35 ,$0.16 ,2,
11/20/2017,Big Rock Partners Acquisition ,BRPAU,EarlyBirdCapital,$10.00 ,$10.01 ,$10.01 ,0.10%,$0.01 ,$0.01 ,1,
2/3/2016,"BeiGene, Ltd. ",BGNE,Goldman Sachs/ Morgan Stanley/ Cowen and Company,$24.00 ,$28.97 ,$28.32 ,18.00%,$4.97 ,$4.32 ,3,
2/3/2016,Editas Medicine ,EDIT,Morgan Stanley/ J.P. Morgan,$16.00 ,$18.00 ,$18.20 ,13.75%,$2.00 ,$2.20 ,2,
2/11/2016,AveXis ,AVXS,Goldman Sachs/ Jefferies,$20.00 ,$18.02 ,$18.05 ,-9.75%,($1.98),($1.95),2,Missed
2/11/2016,Proteostasis Therapeutics ,PTI,Leerink Partners/ RBC Capital Markets,$8.00 ,$8.00 ,$6.64 ,-17.00%,$0.00 ,($1.36),1,
2/24/2016,Silver Run Acquisition ,SRAQU,Deutsche Bank Securities/ Citigroup/ Goldman Sachs,$10.00 ,$10.01 ,$10.21 ,2.10%,$0.01 ,$0.21 ,1,
3/3/2016,Jensyn Acquisition ,JSYNU,Chardan Capital Markets,$10.00 ,$9.95 ,$9.95 ,-0.50%,($0.05),($0.05),1,
3/3/2016,Syndax Pharmaceuticals ,SNDX,Morgan Stanley/ Citigroup,$12.00 ,$12.11 ,$12.01 ,0.08%,$0.11 ,$0.01 ,1,
3/11/2016,KLR Energy Acquisition ,KLREU,EarlyBirdCapital,$10.00 ,$10.00 ,$10.00 ,0.00%,$0.00 ,$0.00 ,1,
3/22/2016,Corvus Pharmaceuticals ,CRVS,Credit Suisse/ Cowen and Company,$15.00 ,$15.00 ,$14.25 ,-5.00%,$0.00 ,($0.75),1,
4/7/2016,Aeglea BioTherapeutics ,AGLE,UBS Investment Bank/ BMO Capital Markets/ Wells Fargo Securities,$10.00 ,$10.40 ,$9.77 ,-2.30%,$0.40 ,($0.23),1,
4/15/2016,Bats Global Markets ,BATS,Morgan Stanley/ Citigroup,$19.00 ,$22.88 ,$23.00 ,21.05%,$3.88 ,$4.00 ,3,
4/20/2016,MGM Growth Properties LLC ,MGP,BofA Merrill Lynch/ J.P. Morgan/ Morgan Stanley/ Evercore ISI/ Barclays/ Citigroup/ Deutsche Bank Securities,$21.00 ,$22.75 ,$22.01 ,4.81%,$1.75 ,$1.01 ,2,
4/21/2016,American Renal Associates Holdings ,ARA,BofA Merrill Lynch/ Barclays/ Goldman Sachs/ Wells Fargo Securities/ SunTrust Robinson Humphrey/Leerink Partners,$22.00 ,$26.50 ,$26.50 ,20.45%,$4.50 ,$4.50 ,2,
4/22/2016,SecureWorks ,SCWX,BofA Merrill Lynch/ Morgan Stanley/ Goldman Sachs/ J.P. Morgan,$14.00 ,$13.91 ,$14.00 ,0.00%,($0.09),$0.00 ,1,
4/27/2016,Red Rock Resorts ,RRR,Deutsche Bank Securities/ J.P. Morgan/ BofA Merrill Lynch/ Goldman Sachs,$19.50 ,$18.50 ,$18.70 ,-4.10%,($1.00),($0.80),1,
4/27/2016,Yintech Investment Holdings Limited ,YIN,Jefferies,$13.50 ,$13.80 ,$13.50 ,0.00%,$0.30 ,$0.00 ,1,
5/6/2016,Intellia Therapeutics ,NTLA,Credit Suisse/ Jefferies/ Leerink Partners,$18.00 ,$22.00 ,$22.10 ,22.78%,$4.00 ,$4.10 ,3,
5/6/2016,Spring Bank Pharmaceuticals ,SBPH,Dawson James Securities,$12.00 ,$11.28 ,$11.10 ,-7.50%,($0.72),($0.90),1,
5/12/2016,SiteOne Landscape Supply ,SITE,Deutsche Bank Securities/ Goldman Sachs/ UBS Investment Bank,$21.00 ,$25.90 ,$26.67 ,27.00%,$4.90 ,$5.67 ,1,Missed
5/13/2016,Acacia Communications,ACIA,Goldman Sachs/ BofA Merrill Lynch/ Deutsche Bank Securities,$23.00 ,$29.00 ,$30.95 ,34.57%,$6.00 ,$7.95 ,3,
5/13/2016,Oncobiologics ,ONSIU,Jefferies/ Barclays,$6.00 ,$5.12 ,$4.80 ,-20.00%,($0.88),($1.20),1,
5/18/2016,PhaseRx ,PZRX,Laidlaw & Company (UK) Ltd.,$4.00 ,$4.13 ,$4.17 ,4.25%,$0.13 ,$0.17 ,1,
5/19/2016,Grupo Supervielle S.A. ,SUPV,Morgan Stanley/ BofA Merrill Lynch,$11.00 ,$11.50 ,$11.50 ,4.55%,$0.50 ,$0.50 ,1,
5/19/2016,Merus B.V. ,MRUS,Citigroup/ Jefferies,$10.00 ,$9.75 ,$10.04 ,0.40%,($0.25),$0.04 ,1,
5/20/2016,CF Corporation ,CFCOU,Citigroup/ BofA Merrill Lynch/ Credit Suisse?,$10.00 ,$10.04 ,$9.99 ,-0.10%,$0.04 ,($0.01),1,
