Date,Issuer,Symbol,Lead/Joint-Lead  Managers,Offer Price,Opening Price,1st Day Close,1st Day % Px Chng,$ Chg Opening,$ Chg Close,Star Ratings,Performed
6/6/2013,"LightInTheBox Holding Co., Ltd.   ",LITB,Credit Suisse/ Stifel,$9.50 ,$11.16 ,$11.61 ,22.21%,$1.66 ,$2.11 ,2,
6/7/2013,Textura   ,TXTR,Credit Suisse/ William Blair,$15.00 ,$24.00 ,$20.94 ,39.60%,$9.00 ,$5.94 ,3,
6/12/2013,Gigamon ,GIMO,"Goldman, Sachs/ BofA Merrill Lynch/ Credit Suisse",$19.00 ,$23.08 ,$28.47 ,49.84%,$4.08 ,$9.47 ,3,
6/13/2013,Coty  ,COTY,BofA Merrill Lynch/ J.P. Morgan/ Morgan Stanley/ Barclays/ Deutsche Bank Securities/ Wells Fargo Securities,$17.50 ,$17.30 ,$17.36 ,-0.80%,($0.20),($0.14),3,Missed
6/20/2013,bluebird bio ,BLUE,J.P. Morgan/ BofA Merrill Lynch,$17.00 ,$25.72 ,$26.39 ,55.24%,$8.72 ,$9.39 ,3,
6/21/2013,PTC Therapeutics   ,PTCT,J.P. Morgan/ Credit Suisse,$15.00 ,$15.85 ,$16.49 ,9.93%,$0.85 ,$1.49 ,3,
6/21/2013,Gogo ,GOGO,Morgan Stanley/ J .P. Morgan/ UBS Securities,$17.00 ,$16.00 ,$16.00 ,-5.88%,($1.00),($1.00),3,Missed
6/26/2013,Esperion Therapeutics ,ESPR,Credit Suisse/ Citigroup,$15.00 ,$17.00 ,$14.50 ,-3.33%,$2.00 ,($0.50),2,
6/26/2013,Luxoft Holding ,LXFT,UBS Investment Bank/ Credit Suisse/ J.P. Morgan,$17.00 ,$18.55 ,$20.30 ,19.41%,$1.55 ,$3.30 ,2,
6/26/2013,NanoString Technologies ,NSTG,J.P. Morgan/ Morgan Stanley,$10.00 ,$9.90 ,$8.06 ,-19.40%,($0.10),($1.94),1,
6/27/2013,Aratana Therapeutics  ,PETX,Stifel/ Lazard Capital Markets,$6.00 ,$7.00 ,$8.26 ,37.67%,$1.00 ,$2.26 ,1,
6/27/2013,CDW Corp  ,CDW,"J.P. Morgan/ Barclays/ Goldman, Sachs",$17.00 ,$17.68 ,$18.37 ,8.06%,$0.68 ,$1.37 ,1,
6/27/2013,HD Supply Holdings ,HDS,BofA Merrill Lynch/ Barclays/ J.P. Morgan/ Credit Suisse,$18.02 ,$18.55 ,$18.66 ,3.55%,$0.53 ,$0.64 ,1,
6/27/2013,MedWorth Acquisition ,MWRX,EarlyBirdCapital,$8.00 ,$8.01 ,$8.01 ,0.12%,$0.01 ,$0.01 ,1,
6/27/2013,Silvercrest Asset Management Group (SAMG),SAMG,Sandler ONeill & Partners/ Raymond James,$11.00 ,$11.40 ,$11.83 ,7.55%,$0.40 ,$0.83 ,1,
6/27/2013,Tremor Video  ,TRMR,Credit Suisse/ Jefferies,$10.00 ,$11.00 ,$8.50 ,-15.00%,$1.00 ,($1.50),2,
6/28/2013,Noodles & Company ,NDLS,Morgan Stanley/ UBS Securities,$18.00 ,$32.00 ,$36.75 ,104.17%,$14.00 ,$18.75 ,3,
6/28/2013,Prosensa Holding B.V. ,RNA,J.P. Morgan/ Citigroup/ Leerink Swann,$13.00 ,$20.00 ,$19.25 ,48.08%,$7.00 ,$6.25 ,2,
7/12/2013,Fifth Street Senior Floating Rate (  FSFR),FSFR,  Morgan Stanley/ Deutsche Bank Securities/ UBS Investment Bank/ Barclays/ RBC Capital Markets/ Oppenheimer,$15.00 ,$14.12 ,$14.15 ,-5.67%,($0.88),($0.85),1,
7/17/2013,NRG Yield  ,NYLD,BofA Merrill Lynch,$22.00 ,$26.69 ,$27.25 ,23.86%,$4.69 ,$5.25 ,2,
7/18/2013,OncoMed Pharmaceuticals ,OMED,Jefferies/ Leerink Swann,$17.00 ,$28.16 ,$27.18 ,59.88%,$11.16 ,$10.18 ,3,
7/18/2013,UCP ,UCP,Citigroup/ Deutsche Bank Securities/ Zelman Partners LLC,$15.00 ,$17.75 ,$14.00 ,-6.67%,$2.75 ,($1.00),2,Missed
7/19/2013,Diamond Resorts International ,DRII,Credit Suisse/ BofA Merrill Lynch/ J.P. Morgan/ Guggenheim Securities,$14.00 ,$14.56 ,$16.15 ,15.36%,$0.56 ,$2.15 ,1,
7/19/2013,Physicians Realty Trust ,DOC,Wunderlich Securities/ Oppenheimer/ Janney Montgomery Scott/ JMP Securities/ BB&T Capital Markets,$11.50 ,$11.50 ,$11.67 ,1.48%,$0.00 ,$0.17 ,1,
7/19/2013,RetailMeNot ,SALE,Morgan Stanley/ Goldman Sachs/ Credit Suisse,$21.00 ,$26.50 ,$27.70 ,31.90%,$5.50 ,$6.70 ,2,
7/19/2013,Rexford Industrial Realty ,REXR,BofA Merrill Lynch/ Wells Fargo Securities/ FBR,$14.00 ,$14.75 ,$14.04 ,0.29%,$0.75 ,$0.04 ,1,
7/23/2013,Phillips 66 Partners LP  ,PSXP,J.P. Morgan/ Morgan Stanley,$23.00 ,$28.98 ,$29.70 ,29.13%,$5.98 ,$6.70 ,3,
7/24/2013,Agios Pharmaceuticals ,AGIO,"J.P. Morgan/ Goldman, Sachs & Co.",$18.00 ,$29.00 ,$31.28 ,73.78%,$11.00 ,$13.28 ,3,
7/24/2013,Heat Biologics ,HTBX,Aegis Capital Corp.,$10.00 ,$10.00 ,$9.57 ,-4.30%,$0.00 ,($0.43),1,
7/24/2013,Jones Energy ,JONE,J.P. Morgan/ Barclays/ Wells Fargo Securities,$15.00 ,$14.04 ,$13.83 ,-7.80%,($0.96),($1.17),1,
7/25/2013,Cellular Dynamics International ,ICEL,J.P. Morgan,$12.00 ,$11.00 ,$9.50 ,-20.83%,($1.00),($2.50),3,Missed
7/25/2013,Conatus Pharmaceuticals ,CNAT,Stifel/ Piper Jaffray,$11.00 ,$11.21 ,$9.50 ,-13.64%,$0.21 ,($1.50),2,Missed
7/25/2013,Onconova Therapeutics ,ONTX,Citigroup/ Leerink Swann,$15.00 ,$25.00 ,$19.88 ,32.53%,$10.00 ,$4.88 ,3,
7/25/2013,Silver Eagle Acquisition ,EAGLU,Deutsche Bank Securities,$10.00 ,$10.00 ,$10.00 ,0.00%,$0.00 ,$0.00 ,1,
7/25/2013,WCI Communities ,WCIC,Citigroup/ Credit Suisse/ J.P. Morgan,$15.00 ,$15.25 ,$15.12 ,0.80%,$0.25 ,$0.12 ,1,
7/26/2013,Liquid Holdings Group ,LIQD,Sandler ONeill & Partners,$9.00 ,$9.06 ,$7.64 ,-15.11%,$0.06 ,($1.36),1,
7/26/2013,"Marlin Midstream Partners, LP  ",FISH,Stifel/ Baird/ Oppenheimer,$20.00 ,$19.51 ,$19.50 ,-2.50%,($0.49),($0.50),2,Missed
8/1/2013,American Homes 4 Rent  ,AMH,"Goldman, Sachs/ BofA Merrill Lynch/ J.P. Morgan/ Wells Fargo Securities",$16.00 ,$15.59 ,$13.50 ,-15.63%,($0.41),($2.50),1,
8/1/2013,Ardmore Shipping ,ASC,Morgan Stanley/ Jefferies/ Clarkson Capital Markets,$14.00 ,$13.50 ,$15.60 ,11.43%,($0.50),$1.60 ,1,
8/1/2013,Sprouts Farmers Markets ,SFM,"Goldman, Sachs/ Credit Suisse/ BofA Merrill Lynch",$18.00 ,$35.00 ,$40.11 ,122.83%,$17.00 ,$22.11 ,3,
8/2/2013,Athlon Energy  ,ATHL,Citigroup,$20.00 ,$26.00 ,$27.56 ,37.80%,$6.00 ,$7.56 ,2,
8/2/2013,Control4 Corporation   ,CTRL,BofA Merrill Lynch/ Raymond James,$16.00 ,$18.70 ,$20.50 ,28.13%,$2.70 ,$4.50 ,2,
8/2/2013,Marrone Bio Innovations ,MBII,Jefferies/ Piper Jaffray,$12.00 ,$13.09 ,$13.75 ,14.58%,$1.09 ,$1.75 ,1,
8/7/2013,YuMe  ,YUME,Citigroup/ Deutsche Bank Securities,$9.00 ,$9.00 ,$9.00 ,0.00%,$0.00 ,$0.00 ,1,
8/8/2013,Fox Factory Holding  ,FOXF,Baird/ William Blair/ Piper Jaffray,$15.00 ,$18.22 ,$18.61 ,24.07%,$3.22 ,$3.61 ,3,
8/8/2013,Intrexon ,XONE,J.P. Morgan/ Barclays,$16.00 ,$21.10 ,$24.73 ,54.56%,$5.10 ,$8.73 ,3,
8/9/2013,Cvent  ,CVT,"Morgan Stanley/ Goldman, Sachs",$21.00 ,$38.00 ,$32.92 ,56.76%,$17.00 ,$11.92 ,3,
8/9/2013,Franks International N.V. ,FI,Barclays/ Credit Suisse/ Simmons & Company,$22.00 ,$27.25 ,$26.35 ,19.77%,$5.25 ,$4.35 ,3,
8/9/2013,"QEP Midstream Partners, LP ",QEPM,"Wells Fargo Securities/ Morgan Stanley/ Citigroup/ Deutsche Bank Securities/ J.P. Morgan/ Goldman, Sachs",$21.00 ,$23.37 ,$22.25 ,5.95%,$2.37 ,$1.25 ,1,Missed
8/9/2013,Quinpario Acquisition ,QPACU,C&Co/PrinceRidge,$10.00 ,$10.00 ,$10.04 ,0.40%,$0.00 ,$0.04 ,1,
8/9/2013,Stock Building Supply Holdings ,STCK,"Goldman, Sachs/ Barclays/ Citigroup",$14.00 ,$14.76 ,$14.43 ,3.07%,$0.76 ,$0.43 ,1,
8/9/2013,"World Point Terminals, LP ",WPT,BofA Merrill Lynch,$20.00 ,$19.50 ,$19.56 ,-2.20%,($0.50),($0.44),1,
8/13/2013,China Commercial Credit  ,CCCR,Burnham Securities,$6.50 ,$6.00 ,$6.39 ,-1.69%,($0.50),($0.11),1,
8/13/2013,Independence Realty Trust ,IRT,Ladenburg Thalmann/ Compass Point/ JMP Securities,$8.50 ,$8.09 ,$8.45 ,-0.59%,($0.41),($0.05),1,
8/14/2013,Envision Healthcare Holdings ,EVH,"Goldman, Sachs/ Barclays/ BofA Merrill Lynch/ Citigroup",$23.00 ,$25.25 ,$25.15 ,9.35%,$2.25 ,$2.15 ,3,
8/15/2013,Third Point Reinsurance ,TPRE,J.P. Morgan/ Credit Suisse/ Morgan Stanley/ BofA Merrill Lynch/ Citigroup,$12.50 ,$12.25 ,$13.06 ,4.48%,($0.25),$0.56 ,1,
8/22/2013,Regado Biosciences ,RGDO,Cowen and Company/ BMO Capital Markets,$4.00 ,$5.00 ,$4.70 ,17.50%,$1.00 ,$0.70 ,1,
9/13/2013,OCI Resources LP   ,OCIR,"Citigroup/ Goldman, Sachs",$19.00 ,$18.25 ,$18.00 ,-5.26%,($0.75),($1.00),2,Missed
9/17/2013,ROI Acquisition Corp. II  ,ROIQU,Deutsche Bank Securities,$10.00 ,$10.00 ,$10.00 ,0.00%,$0.00 ,$0.00 ,1,
9/18/2013,Benefitfocus ,BNFY,"Goldman, Sachs/ Deutsche Bank Securities/ Jefferies",$26.50 ,$42.27 ,$53.55 ,102.08%,$15.77 ,$27.05 ,3,
9/18/2013,Five Prime Therapeutics ,FPRX,Jefferies/ BMO Capital Markets/ Wells Fargo Securities,$13.00 ,$16.00 ,$13.08 ,0.62%,$3.00 ,$0.08 ,3,
9/18/2013,Volaris Aviation Holding  ,VLRS,Deutsche Bank Securities/ Morgan Stanley / UBS Investment Bank,$12.00 ,$12.76 ,$14.01 ,16.75%,$0.76 ,$2.01 ,1,Missed
9/19/2013,Acceleron Pharma  ,XLRN,Citigroup/ Leerink Swann,$15.00 ,$18.86 ,$19.99 ,33.27%,$3.86 ,$4.99 ,3,
9/20/2013,BIND Therapeutics ,BIND,Credit Suisse/ Cowen and Company,$15.00 ,$15.00 ,$14.09 ,-6.07%,$0.00 ,($0.91),2,Missed
9/20/2013,ClubCorp Holdings ,MYCC,"Goldman, Sachs/ Jefferies/ Citigroup",$14.00 ,$15.25 ,$14.50 ,3.57%,$1.25 ,$0.50 ,1,
9/20/2013,FireEye ,FEYE,"Morgan Stanley, Goldman, Sachs/ J.P. Morgan/ Barclays/",$20.00 ,$40.30 ,$36.00 ,80.00%,$20.30 ,$16.00 ,3,
9/20/2013,Rocket Fuel   ,FUEL,Credit Suisse/ Citigroup,$29.00 ,$59.95 ,$56.10 ,93.45%,$30.95 ,$27.10 ,3,
9/25/2013,Capitala Finance ,CPTA,Deutsche Bank Securities/ UBS Investment Bank/ Barclays,$20.00 ,$19.15 ,$18.80 ,-6.00%,($0.85),($1.20),1,
9/25/2013,Evoke Pharma ,EVOK,Aegis Capital Corp.,$12.00 ,$11.15 ,$11.74 ,-2.17%,($0.85),($0.26),1,
9/25/2013,Foundation Medicine ,FMI,"Goldman, Sachs/ J.P. Morgan",$18.00 ,$31.50 ,$35.35 ,96.39%,$13.50 ,$17.35 ,3,
9/25/2013,Ophthotech  ,OPHT,Morgan Stanley/ J.P. Morgan,$22.00 ,$23.06 ,$26.30 ,19.55%,$1.06 ,$4.30 ,3,
9/26/2013,Applied Optoelectronics  ,AAOI,Raymond James/ Piper Jaffray,$10.00 ,$10.00 ,$9.96 ,-0.40%,$0.00 ,($0.04),1,
9/26/2013,Covisint ,COVS,Credit Suisse/ Pacific Crest Securities,$10.00 ,$12.60 ,$12.31 ,23.10%,$2.60 ,$2.31 ,2,
9/26/2013,Montage Technology Group ,MONT,Deutsche Bank Securities/ Barclays/ Stifel,$10.00 ,$10.00 ,$12.80 ,28.00%,$0.00 ,$2.80 ,1,
9/26/2013,Premier ,PINC,J.P. Morgan/ BofA Merrill Lynch/ Wells Fargo Securities,$27.00 ,$31.00 ,$30.65 ,13.52%,$4.00 ,$3.65 ,3,
9/27/2013,Enzymotec ,ENZY,BofA Merrill Lynch/ Jefferies,$14.00 ,$14.25 ,$18.16 ,29.71%,$0.25 ,$4.16 ,1,
9/27/2013,Pattern Energy Group ,PEGI,BMO Capital Markets/ RBC Capital Markets/ Morgan Stanley,$22.00 ,$24.10 ,$23.27 ,5.77%,$2.10 ,$1.27 ,2,
9/27/2013,RingCentral ,RNG,"Goldman, Sachs/ J.P. Morgan/ BofA Merrill Lynch",$13.00 ,$17.25 ,$18.20 ,40.00%,$4.25 ,$5.20 ,3,
9/27/2013,Violin Memory ,VMEN,J.P. Morgan/ Deutsche Bank Securities/ BofA Merrill Lynch,$9.00 ,$7.50 ,$7.02 ,-22.00%,($1.50),($1.98),1,
10/1/2013,Fate Therapeutics  ,FATE,Cowen and Company/ BMO Capital Markets,$6.00 ,$6.56 ,$6.62 ,10.33%,$0.56 ,$0.62 ,1,
10/2/2013,Burlington Holdings  ,BURL,"J.P. Morgan/ Goldman, Sachs/ Morgan Stanley/ BofA Merrill Lynch/ Wells Fargo Securities",$17.00 ,$23.05 ,$25.01 ,47.12%,$6.05 ,$8.01 ,2,
10/2/2013,Empire State Realty Trust ,ESRT,"Goldman, Sachs/ BofA Merrill Lynch",$13.00 ,$13.05 ,$13.10 ,0.77%,$0.05 ,$0.10 ,1,
10/2/2013,RE/MAX Holdings ,RMAX,Morgan Stanley/ BofA Merrill Lynch/ J.P. Morgan,$22.00 ,$26.25 ,$27.00 ,22.73%,$4.25 ,$5.00 ,3,
10/3/2013,Cherry Hill Mortgage Investment ,CHMI,Barclays/ Morgan Stanley/ Citigroup/ UBS Investment Bank,$20.00 ,$18.50 ,$18.48 ,-7.60%,($1.50),($1.52),1,
10/3/2013,OCI Partners LP,OCIP,BofA Merrill Lynch/ Barclays/ Citigroup,$18.00 ,$17.25 ,$18.80 ,4.44%,($0.75),$0.80 ,1,
10/3/2013,Potbelly Corporation ,PBPB,"BofA Merrill Lynch/ Goldman, Sachs",$14.00 ,$28.75 ,$30.44 ,117.43%,$14.75 ,$16.44 ,3,
10/9/2013,LDR Holding ,LDRH,"Piper Jaffray/ William Blair/ Bryan, Garnier",$15.00 ,$18.50 ,$19.35 ,29.00%,$3.50 ,$4.35 ,3,
10/9/2013,QTS Realty Trust   ,QTS,"Goldman, Sachs/ Jefferies",$21.00 ,$22.40 ,$21.00 ,0.00%,$1.40 ,$0.00 ,1,
10/9/2013,SFX Entertainment   ,SFXE,UBS Investment Bank/ Jefferies/ Deutsche Bank Securitie,$13.00 ,$13.03 ,$11.89 ,-8.54%,$0.03 ,($1.11),3,Missed
10/10/2013,Antero Resources ,AR,Barclays/ Citigroup/ J.P. Morgan,$44.00 ,$54.15 ,$52.01 ,18.20%,$10.15 ,$8.01 ,3,
10/10/2013,MacroGenics ,MGNX,BofA Merrill Lynch/ Leerink Swann,$16.00 ,$24.00 ,$24.99 ,56.19%,$8.00 ,$8.99 ,3,
10/10/2013,Stonegate Mortgage ,SGM,BofA Merrill Lynch/ Credit Suisse/ Barclays/ FBR,$16.00 ,$17.18 ,$18.25 ,14.06%,$1.18 ,$2.25 ,1,
10/10/2013,"Western Refining Logistics, LP  ",WNRL,BofA Merrill Lynch/ Barclays/ Goldman Sachs/ Wells Fargo Securities,$22.00 ,$24.00 ,$24.10 ,9.55%,$2.00 ,$2.10 ,3,
10/16/2013,"Plains GP Holdings, L.P. ",PAGP,Barclays/ Goldman Sachs/ J.P. Morgan/ BofA Merrill Lynch/ Citigroup/ UBS Investment Bank/ Wells Fargo Securities,$22.00 ,$22.80 ,$22.00 ,0.00%,$0.80 ,$0.00 ,2,
10/16/2013,Springleaf Holdings  ,LEAF,BofA Merrill Lynch/ Barclays/ Citigroup/ Credit Suisse,$17.00 ,$19.18 ,$19.26 ,13.29%,$2.18 ,$2.26 ,2,
10/16/2013,Veeva Systems ,VEEV,Morgan Stanley/ Deutsche Bank Securities,$20.00 ,$38.50 ,$37.16 ,85.80%,$18.50 ,$17.16 ,3,
10/17/2013,ADMA Biologics ,ADMA,Oppenheimer & Co.,$8.50 ,$7.00 ,$8.55 ,0.59%,($1.50),$0.05 ,1,
10/18/2013,voxeljet AG  ,VJET,Piper Jaffray/ Citigroup,$13.00 ,$20.00 ,$28.80 ,121.54%,$7.00 ,$15.80 ,3,
10/24/2013,Global Defense & National Security Systems  ,GDEF,Cowen and Company,$10.00 ,$10.00 ,$10.01 ,0.10%,$0.00 ,$0.01 ,1,
10/25/2013,Aerie Pharmaceuticals  ,AERI,RBC Capital Markets/ Stifel,$10.00 ,$10.51 ,$10.61 ,6.10%,$0.51 ,$0.61 ,1,
10/25/2013,CommScope Holding ,COMM,J.P. Morgan/ Deutsche Bank Securities/ BofA Merrill Lynch,$15.00 ,$15.00 ,$14.99 ,-0.07%,$0.00 ,($0.01),1,
10/25/2013,Endurance International Group Holdings ,EIGI,"Goldman, Sachs/ Credit Suisse/ Morgan Stanley",$12.00 ,$11.00 ,$11.25 ,-6.25%,($1.00),($0.75),2,Missed
10/25/2013,Sprague Resources LP ,SRLP,Barclays/ J.P. Morgan/ BofA Merrill Lynch,$18.00 ,$17.50 ,$17.75 ,-1.39%,($0.50),($0.25),1,
10/29/2013,Quartet Merger ,QTETU,EarlyBirdCapital,$10.00 ,$10.01 ,$10.05 ,0.50%,$0.01 ,$0.05 ,1,
10/30/2013,Brixmor Property Group ,BRX,BofA Merrill Lynch/ Citigroup/ J.P. Morgan/ Wells Fargo Securities/ Barclays/ Deutsche Bank Securities/ RBC Capital Markets/ UBS Investment Bank,$20.00 ,$20.65 ,$20.40 ,2.00%,$0.65 ,$0.40 ,2,
10/30/2013,Criteo S.A.  ,CRTO,J.P. Morgan/ Deutsche Bank Securities/ Jefferies/ Stifel,$31.00 ,$42.00 ,$35.39 ,14.16%,$11.00 ,$4.39 ,3,
10/30/2013,Surgical Care Affiliates  ,SCAI,J.P. Morgan/ Citigroup,$24.00 ,$28.00 ,$27.10 ,12.92%,$4.00 ,$3.10 ,3,
10/30/2013,Veracyte ,VCYT,Morgan Stanley/ Leerink Swann,$13.00 ,$13.03 ,$13.25 ,1.92%,$0.03 ,$0.25 ,2,Missed
10/31/2013,58.com ,WUBA,Morgan Stanley/ Credit Suisse/ Citigroup,$17.00 ,$21.20 ,$24.12 ,41.88%,$4.20 ,$7.12 ,3,
10/31/2013,Essent Group Ltd.  ,ESNT,"Goldman, Sachs/ J.P. Morgan/ Credit Suisse/ Barclays",$17.00 ,$22.01 ,$21.00 ,23.53%,$5.01 ,$4.00 ,3,
10/31/2013,Marcus & Millichap  ,MMI,Citigroup/ Goldman Sachs,$12.00 ,$13.40 ,$13.42 ,11.83%,$1.40 ,$1.42 ,1,
11/1/2013,Container Store Group   ,TCS,J.P. Morgan/ Barclays/ Credit Suisse,$18.00 ,$35.00 ,$36.20 ,101.11%,$17.00 ,$18.20 ,3,
11/1/2013,Qunar Cayman Islands Ltd.   ,QUNR,Goldman Sachs (Asia)/ Deutsche Bank Securities,$15.00 ,$28.35 ,$28.40 ,89.33%,$13.35 ,$13.40 ,3,
11/6/2013,Arc Logistics Partners LP ,ARCX,Citigroup/ Barclays/ SunTrust Robinson Humphrey,$19.00 ,$19.00 ,$19.00 ,0.00%,$0.00 ,$0.00 ,1,
11/6/2013,Avianca Holdings S.A.  ,AVH,J.P. Morgan/ Citigroup,$15.00 ,$14.00 ,$14.00 ,-6.67%,($1.00),($1.00),1,
11/6/2013,Barracuda Networks   ,CUDA,Morgan Stanley/ J.P. Morgan Securities/ BofA Merrill Lynch,$18.00 ,$22.59 ,$21.55 ,19.72%,$4.59 ,$3.55 ,2,
11/6/2013,Blue Capital Reinsurance Holdings ,BCRH,"Deutsche Bank Securities/ UBS Investment Bank/ Barclays/ Keefe, Bruyette & Woods (A Stifel Company)",$20.00 ,$19.45 ,$18.90 ,-5.50%,($0.55),($1.10),1,
11/6/2013,Karyopharm Therapeutics ,KPTI,BofA Merrill Lynch/ Leerink Swann,$16.00 ,$17.86 ,$16.05 ,0.31%,$1.86 ,$0.05 ,1,
11/16/2013,Wix.com Ltd.  ,WIX,J.P. Morgan/ BofA Merrill Lynch/ RBC Capital Markets,$16.50 ,$18.50 ,$16.31 ,-1.15%,$2.00 ,($0.19),3,
11/7/2013,LGI Homes  ,LGIH, Deutsche Bank Securities/ JMP Securities/ J.P. Morgan ,$11.00 ,$12.13 ,$12.90 ,17.27%,$1.13 ,$1.90 ,1,
11/7/2013,Mavenir Systems ,MVNR,Morgan Stanley/ BofA Merrill Lynch/ Deutsche Bank Securities,$10.00 ,$11.25 ,$9.64 ,-3.60%,$1.25 ,($0.36),1,
11/7/2013,"Midcoast Energy Partners, L.P.  ",MEP,BofA Merrill Lynch/ Barclays/ Citigroup/ Credit Suisse/ Deutsche Bank Securities/ Goldman Sachs/ J.P. Morgan/ Morgan Stanley/ Wells Fargo Securities/ UBS Investment Bank,$18.00 ,$17.00 ,$17.49 ,-2.83%,($1.00),($0.51),1,
11/7/2013,Norcraft Companies ,NCFT,Citigroup/ UBS Investment Bank/ Deutsche Bank Securities/ RBC Capital Markets,$16.00 ,$15.75 ,$15.50 ,-3.13%,($0.25),($0.50),1,
11/7/2013,StoneCastle Financial ,BANX,"Keefe, Bruyette & Woods (A Stifel Company)/ Baird/ Oppenheimer",$25.00 ,$25.00 ,$25.00 ,0.00%,$0.00 ,$0.00 ,1,
11/7/2013,Twitter  ,TWTR,Goldman Sachs/ Morgan Stanley/ J.P. Morgan/ BofA Merrill Lynch/ Deutsche Bank Securities,$26.00 ,$45.10 ,$44.90 ,72.69%,$19.10 ,$18.90 ,3,
11/8/2013,JGWPT Holdings ,JGW,Barclays/ Credit Suisse,$14.00 ,$13.37 ,$12.82 ,-8.43%,($0.63),($1.18),1,
11/8/2013,NMI Holdings ,NMIH,FBR,$13.00 ,$14.00 ,$14.00 ,7.69%,$1.00 ,$1.00 ,1,
11/13/2013,Chegg ,CHGG,J.P. Morgan/ BofA Merrill Lynch,$12.50 ,$10.87 ,$9.68 ,-22.56%,($1.63),($2.82),3,Missed
11/13/2013,Dynagas LNG Partners LP ,DLNG,Credit Suisse,$18.00 ,$17.00 ,$18.00 ,0.00%,($1.00),$0.00 ,1,
11/13/2013,Extended Stay America/ ESH Hospitality ,STAY,"Deutsche Bank Securities/ Goldman, Sachs/ J.P. Morgan",$20.00 ,$22.75 ,$23.87 ,19.35%,$2.75 ,$3.87 ,2,Missed
11/14/2013,Levy Acquisition ,LEVYU,Citigroup,$10.00 ,$9.95 ,$10.02 ,0.20%,($0.05),$0.02 ,1,
11/14/2013,Tandem Diabetes Care ,TNDM,BoA Merrill Lynch/ Piper Jaffray,$15.00 ,$19.50 ,$19.26 ,28.40%,$4.50 ,$4.26 ,2,
11/14/2013,Houghton Mifflin Harcourt ,HMHC,"Goldman, Sachs/ Morgan Stanley",$12.00 ,$14.00 ,$15.86 ,32.17%,$2.00 ,$3.86 ,1,
11/15/2013,Relypsa ,RLYP,Morgan Stanley/ BofA Merrill Lynch,$11.00 ,$12.59 ,$12.24 ,11.27%,$1.59 ,$1.24 ,1,
11/15/2013,zulily ,ZU,Goldman Sachs/ BofA Merrill Lynch/ Citigroup,$15.00 ,$19.50 ,$19.26 ,28.40%,$4.50 ,$4.26 ,3,
11/21/2013,Navigator Holdings Ltd ,NVGS,Jefferies/ Morgan Stanley,$19.00 ,$20.40 ,$20.00 ,5.26%,$1.40 ,$1.00 ,2,
11/22/2013,500.com Ltd  ,WBAI,Deutsche Bank Securities,$13.00 ,$20.00 ,$20.01 ,53.92%,$7.00 ,$7.01 ,3,
11/22/2013,Oxford Immunotec Global PLC ,OXFD,J.P. Morgan/ Piper Jaffray,$12.00 ,$14.00 ,$15.40 ,28.33%,$2.00 ,$3.40 ,2,
11/22/2013,Sungy Mobile ,GOMO,Credit Suisse/ J.P. Morgan,$11.22 ,$14.11 ,$13.35 ,18.98%,$2.89 ,$2.13 ,3,
11/22/2013,Vince Holding  ,VNCE,Goldman Sachs/ Baird,$20.00 ,$29.50 ,$28.66 ,43.30%,$9.50 ,$8.66 ,3,
12/3/2013,Xencor ,XNCR,Credit Suisse/ Leerink Swann,$5.50 ,$5.95 ,$8.34 ,51.64%,$0.45 ,$2.84 ,1,
12/11/2013,Autohome  ,ATHM,Deutsche Bank Securities/ Goldman Sachs (Asia) L.L.C.,$17.00 ,$30.16 ,$30.07 ,76.88%,$13.16 ,$13.07 ,3,
12/11/2013,Valero Energy Partners LP ,VLP,J.P. Morgan/ Barclays,$23.00 ,$28.25 ,$28.00 ,21.74%,$5.25 ,$5.00 ,3,
12/12/2013,ARAMARK Holdings ,ARMK,"Goldman, Sach/ J.P. Morgan / Credit Suisse/ Morgan Stanley",$20.00 ,$20.25 ,$22.70 ,13.50%,$0.25 ,$2.70 ,1,
12/12/2013,CatchMark Timber Trust  ,CTT,Raymond James,$13.50 ,$13.50 ,$13.50 ,0.00%,$0.00 ,$0.00 ,1,
12/12/2013,Hilton Worldwide Holdings   ,HLT,"Deutsche Bank Securities/ Goldman, Sachs/ BofA Merrill Lynch/ Morgan Stanley",$20.00 ,$21.30 ,$21.50 ,7.50%,$1.30 ,$1.50 ,3,
12/12/2013,Kindred Biosciences  ,KIN,BMO Capital Markets/ Guggenheim Securities,$7.00 ,$8.75 ,$11.95 ,70.71%,$1.75 ,$4.95 ,1,Missed
12/12/2013,TetraLogic Pharmaceuticals ,TLOG,Oppenheimer & Co.,$7.00 ,$7.00 ,$7.00 ,0.00%,$0.00 ,$0.00 ,1,
12/13/2013,Cheniere Energy Partners LP Holdings ,CQH,Goldman Sachs/ Morgan Stanley/ Credit Suisse/ RBC Capital Markets,$20.00 ,$19.65 ,$19.22 ,-3.90%,($0.36),($0.78),1,
12/13/2013,Fidelity & Guaranty Life ,FGL,Credit Suisse/ J.P. Morgan/ Jefferies/ Macquarie Capital/ RBC Capital Markets,$17.00 ,$18.92 ,$18.86 ,10.94%,$1.92 ,$1.86 ,1,
12/13/2013,Nimble Storage  ,NMBL,Goldman Sachs/ Morgan Stanley,$21.00 ,$31.18 ,$33.93 ,61.57%,$10.18 ,$12.93 ,3,
12/18/2013,AMC Entertainment Holdings ,AMC,Citigroup/ BofA Merrill Lynch/ Barclays/ Credit Suisse,$18.00 ,$19.20 ,$18.90 ,5.00%,$1.20 ,$0.90 ,2,
12/18/2013,Cambridge Capital Acquisition ,CAMBU,EarlyBirdCapital,$10.00 ,$10.00 ,$10.00 ,0.00%,$0.00 ,$0.00 ,1,
1/19/2012,Renewable Energy Group ,REGI,UBS Investment Bank/ Piper Jaffray,$10.00 ,$10.10 ,$10.10 ,1.00%,$0.10 ,$0.10 ,1,
1/25/2012,Guidewire Software ,GWRE,J.P. Morgan/ Deutsche Bank Securities/ Citigroup,$13.00 ,$16.75 ,$17.12 ,31.69%,$3.75 ,$4.12 ,3,
1/27/2012,Verastem ,VSTM,UBS Investment Bank/ Leerink Swann,$10.00 ,$11.00 ,$11.09 ,10.90%,$1.00 ,$1.09 ,1,Missed
2/1/2012,U.S. Silica Holdings ,SLCA,Morgan Stanley/ BofA Merrill Lynch/ Jefferies,$17.00 ,$17.25 ,$16.00 ,-5.88%,$0.25 ,($1.00),2,Missed
2/2/2012,AVG Technologies N.V. ,AVG,"Morgan Stanley/ J.P. Morgan/ Goldman, Sachs",$16.00 ,$13.53 ,$13.00 ,-18.75%,($2.47),($3.00),3,Missed
2/2/2012,Greenway Medical Technologies ,GWAY,J.P. Morgan/ Morgan Stanley/ William Blair,$10.00 ,$10.10 ,$13.00 ,30.00%,$0.10 ,$3.00 ,2,
2/2/2012,Matador Resources ,MTDR,RBC Capital Markets/ Citigroup,$12.00 ,$11.75 ,$11.75 ,-2.08%,($0.25),($0.25),1,
2/3/2012,Cempra Holdings ,CEMP,Stifel Nicolaus Weisel/ Leerink Swann/ Cowen and Company,$6.00 ,$6.18 ,$6.06 ,1.00%,$0.18 ,$0.06 ,1,
2/8/2012,Caesars Entertainment ,CZR,Credit Suisse/ Citigroup/ BofA Merrill Lynch/ Deutsche Bank Securities,$9.00 ,$9.06 ,$15.39 ,71.00%,$0.06 ,$6.39 ,1,
2/8/2012,ChemoCentryx ,CCXI,J.P. Morgan/ Citigroup,$10.00 ,$10.33 ,$11.00 ,10.00%,$0.33 ,$1.00 ,1,
2/8/2012,EPAM Systems ,EPAM,Citigroup/ UBS Investment Bank/ Barclays Capital/ RenCap,$12.00 ,$13.75 ,$14.00 ,16.67%,$1.75 ,$2.00 ,1,
2/8/2012,Roundys Parent ,RNDY,Credit Suisse/ J.P. Morgan/ Jefferies/ Baird,$8.50 ,$8.40 ,$9.00 ,5.88%,($0.10),$0.50 ,2,
2/9/2012,FX Alliance ,FX,"BofA Merrill Lynch/ Goldman, Sachs/ Citigroup/ J.P. Morgan",$12.00 ,$13.60 ,$13.74 ,14.50%,$1.60 ,$1.74 ,1,
2/10/2012,GSE Holding ,GSE,Oppenheimer & Co./ William Blair & Company/ FBR,$9.00 ,$10.30 ,$11.50 ,27.78%,$1.30 ,$2.50 ,1,
2/10/2012,HomeStreet ,HMST,FBR Capital Markets,$44.00 ,$47.51 ,$48.00 ,9.09%,$3.51 ,$4.00 ,2,
2/10/2012,Synacor ,SYNC,BofA Merrill Lynch/ Citigroup/ Stifel Nicolaus Weisel,$5.00 ,$5.75 ,$5.25 ,5.00%,$0.75 ,$0.25 ,1,
2/17/2012,Brightcove ,BCOV,"Morgan Stanley/ Stifel, Nicolaus Weisel",$11.00 ,$14.50 ,$14.30 ,30.00%,$3.50 ,$3.30 ,2,
2/21/2012,Ceres ,CERE,"Goldman, Sachs/ Barclays Capital",$13.00 ,$14.80 ,$14.80 ,13.85%,$1.80 ,$1.80 ,1,
2/24/2012,Bazaarvoice ,BV,Morgan Stanley/ Deutsche Bank Securities/ Credit Suisse,$12.00 ,$16.00 ,$16.51 ,37.58%,$4.00 ,$4.51 ,3,
2/24/2012,Proto Labs ,PRLB,Jefferies/ Piper Jaffray,$16.00 ,$25.00 ,$29.00 ,81.25%,$9.00 ,$13.00 ,3,
2/24/2012,ROI Acquisition ,ROIQU,Deutsche Bank Securities,$10.00 ,$10.00 ,$10.01 ,0.10%,$0.00 ,$0.01 ,1,
2/29/2012,Home Loan Servicing Solutions,HLSS,Wells Fargo Securities/ Barclays Capital/ Citigroup/ Deutsche Bank Securities,$14.00 ,$13.25 ,$13.56 ,-3.14%,($0.75),($0.44),1,
3/2/2012,Yelp!  ,YELP,"Goldman, Sachs/ Citigroup/ Jefferies",$15.00 ,$22.01 ,$24.58 ,63.87%,$7.01 ,$9.58 ,3,
3/7/2012,Select Income REIT ,SIR,Morgan Stanley/ BofA Merrill Lynch/ Wells Fargo Securities,$21.50 ,$21.75 ,$21.74 ,1.12%,$0.25 ,$0.24 ,1,
3/8/2012,Nationstar Mortgage Holdings ,NSM,BofA Merrill Lynch/Citigroup/ Credit Suisse/ Wells Fargo Securities,$14.00 ,$13.57 ,$14.25 ,1.79%,($0.43),$0.25 ,1,
3/15/2012,Allison Transmission Holdings ,ALSN,"BofA Merrill Lynch/ Citi/ J.P. Morgan/ Credit Suisse/ Morgan Stanley/ Goldman, Sachs & Co.",$23.00 ,$23.00 ,$23.40 ,1.74%,$0.00 ,$0.40 ,1,
3/15/2012,Demandware ,DWRE,"Goldman, Sachs/ Deutsche Bank Securities",$16.00 ,$25.25 ,$23.85 ,49.06%,$9.25 ,$7.85 ,3,
3/15/2012,M/A-COM Technology Solutions Holdings ,MTSI,Barclays Capital/ J.P. Morgan/ Jefferies,$19.00 ,$19.10 ,$20.55 ,8.16%,$0.10 ,$1.55 ,2,
3/19/2012,Andina Acquisition ,ANDAU,EarlyBirdCapital,$10.00 ,$9.98 ,$9.97 ,-0.30%,($0.02),($0.03),1,
3/21/2012,BGS Acquisition ,BGSCU,PrinceRidge/ Mitsubishi UFJ Securities,$10.00 ,$9.94 ,$9.87 ,-1.30%,($0.06),($0.13),1,
3/22/2012,CaesarStone Sdot-Yam Ltd. ,CSTE,J.P. Morgan/ Barclays Capital/ Credit Suisse,$11.00 ,$10.99 ,$11.11 ,1.00%,($0.01),$0.11 ,1,
3/22/2012,ExactTarget  ,ET,"J.P. Morgan/ Deutsche Bank Secutities/ Stifel, Nicolaus Weisel",$19.00 ,$23.05 ,$25.11 ,32.16%,$4.05 ,$6.11 ,3,
3/22/2012,Vantiv ,VNTV,"J.P. Morgan/ Morgan Stanley/ Credit Suisse/ Goldman, Sachs & Co./ Deutsche Bank Securities",$17.00 ,$19.00 ,$19.50 ,14.71%,$2.00 ,$2.50 ,2,
3/23/2012,Vipshop Holdings ,VIPS,Goldman Sachs (Asia)/ Deutsche Bank Securities,$6.50 ,$6.00 ,$5.50 ,-15.38%,($0.50),($1.00),1,
3/23/2012,Whiting USA Trust II ,WHZ,Raymond James/ Morgan Stanley,$20.00 ,$21.00 ,$24.46 ,22.30%,$1.00 ,$4.46 ,1,Missed
3/28/2012,Annie’s ,BNNY,Credit Suisse/ J.P. Morgan,$19.00 ,$31.11 ,$35.92 ,89.05%,$12.11 ,$16.92 ,3,
3/28/2012,Regional Management ,RM,Jefferies/ Stephens,$15.00 ,$17.00 ,$16.45 ,9.67%,$2.00 ,$1.45 ,1,
3/28/2012,Vocera Communications ,VCRA,J.P. Morgan/ Piper Jaffray,$19.00 ,$24.00 ,$21.03 ,10.68%,$5.00 ,$2.03 ,2,
3/29/2012,CafePress ,PRSS,J.P. Morgan/ Jefferies,$19.00 ,$21.10 ,$19.03 ,0.16%,$2.10 ,$0.03 ,2,
3/29/2012,Merrimack Pharmaceuticals ,MACK,J.P. Morgan,$7.00 ,$6.16 ,$6.04 ,-13.71%,($0.84),($0.96),1,
3/29/2012,Millennial Media ,MM,"Morgan Stanley/ Goldman, Sachs/ Barclays Capital",$13.00 ,$25.00 ,$25.00 ,92.31%,$12.00 ,$12.00 ,3,
3/29/2012,Rexnord  ,RXN,"BofA Merrill Lynch/ Goldman, Sachs/ Credit Suisse/ Deutsche Bank Securities/ Barclays Capital",$18.00 ,$19.05 ,$20.00 ,11.11%,$1.05 ,$2.00 ,2,
3/30/2012,Enphase Energy ,ENPH,Morgan Stanley/ BofA Merrill Lynch/ Deutsche Bank Securities,$6.00 ,$7.50 ,$7.34 ,22.33%,$1.50 ,$1.34 ,1,
3/30/2012,GasLog Ltd.  ,GLOG,"Goldman, Sachs/ Citigroup",$14.00 ,$12.50 ,$12.41 ,-11.36%,($1.50),($1.59),1,
4/4/2012,TCP Capital ,TCPC,Deutsche Bank Securities/ Stifel Nicolaus Weisel,$14.75 ,$14.25 ,$14.55 ,-1.36%,($0.50),($0.20),1,
4/5/2012,Retail Properties of America ,RPAI,J.P. Morgan/ Citigroup/ Deutsche Bank Securities/ KeyBanc Capital Markets,$8.00 ,$8.78 ,$8.75 ,9.38%,$0.78 ,$0.75 ,1,
4/11/2012,Erickson Air-Crane ,EAC,Stifel Nicolaus Weisel/Oppenheimer/ Lazard Capital Markets,$8.00 ,$8.08 ,$8.00 ,0.00%,$0.08 ,$0.00 ,1,
4/12/2012,Forum Energy Technologies ,FET,J.P. Morgan/BofA Merrill Lynch/ Credit Suisse/ Citigroup/ Deutsche Bank Securities,$20.00 ,$22.50 ,$21.75 ,8.75%,$2.50 ,$1.75 ,2,
